The great desideratum is to put * fore legs out of commission_ and get him down on his knees.,his,materials,any,redbirds
Concerning the possibilities of feeding * on hay at $25 per ton and declaring an annual profit_ I am not informed.,elk,infection,lalang,troubles
The Report from which the above census was taken contains half a column * solid matter_ in small type_ giving a list of the  open seasons  all over Cape Colony_ during which killing may be done!,of,portrait,simultaneously,hominy
A loyal Virginian * me only this year that in his state the warden system is an ineffective farce_ and the game is not protected_ because the wardens can not afford to patrol the state for nothing.,told,center,heedless,beg
If we are faint-hearted_ and eager for peace at any price_ then we will sidestep the ugly situation until the destroyers have settled it for us by the wholesale extermination * species.,of,allowed,pinnated,shameless
But the Texans give me credit for killing at * 2_000 of the entire number.,least,groups,votes,one—on
The law referred to expressly clothes the President of the United States with power to preserve any monumental feature of nature which it clearly is the duty of the state to preserve for all * from the hands of the spoilers.,time,unexcelled,developments,waddled
It * the spirit of extermination according to law.,is,aristocratic,sustain,seventenths
It * to be doubted whether_ up to this hour_ any man has made a list of the species of North American birds that have become extinct during the past sixty years.,is,so,wool,appreciated
And how is it with the other states that number the wood-duck in * avian faunas?,their,legislation,leases,heading
This grandson of Uncle Ike was growing sulky_ too_ with the knowledge that the white man was bribing him with half a loaf to raise cotton and corn when he might * well exact it all.,as,sambar,elephants,apart
One of the earliest * the most celebrated deer parks of the United States was that of Hon.,and,workman,enjoy,politicalmachine
As a net result of all her shortcomings_ the remnant of a once fine fauna of big game and feathered game is * being  exterminated according to law.,surely,roseate,colonies,birds—because
Robins_ too_ * be a rarity if more severe penalties are not imposed.,will,meat,blows,halted
Then_ think of the silent and untouched forests of the Pacific Coast and tell me whether you think five million deer scattered * all those forests would make any visible impression upon them.,through,greedy,precise,true—and
In the Yellowstone Park the pumas multiplied to such * extent and killed so many young elk that their number had to be systematically reduced.,an,bore,planters,northeastern
Yet * is practically what has been done.,that,irresistible,waste,national
The animal was blind in one eye_ and because it would not graze precisely where the wolfer desired it * remain_ he deliberately destroyed the sight of its good eye_ and left it for days_ without the ability to find water.,to,strike,southward,publicity
The men * Illinois have just two alternatives between which to choose: drastic and immediate preservation_ or a gameless state.,of,dowitcher,sedge,educated
The greatest slaughter of wild ducks by disease * on Great Salt Lake_ Utah.,occurred,promoted,sicklebilled,regions—in
It would be possible * record many instances similar to the above_ but why multiply them?,to,pertinent,privilege,anemia
Its influence is greatly * on the firing line_ especially in Illinois_ Wisconsin_ Iowa and northern Minnesota.,needed,childsplay,counting,ornaments
The greatest beauty * those forests is the forest floor_ which lumbering operations would utterly destroy.,of,onset,weapon,chinch
Let * man say that \"it is too late to save the wild life\"; for excepting the dead-and-gone species_ that is not true.,no,numerous—undoubtedly,refuse,solely
A continent without wild life is like a forest with no leaves on * trees.,the,corners,housecat,coccidiosis
When it was pointed out to Congress in 1902_ by Madison Grant_ T.S. Palmer and others that the wild life of Alaska was seriously threatened_ Congress immediately enacted the law that was recommended_ and now appropriates yearly a fair sum for * enforcement.,its,against,fiddling,killingground
At first * and eggs were collected.,guano,manufacturing,perpetrate,hordes
Fancy an animal with the murderous ferocity of a mink_ the agility of a squirrel_ the penetration of a ferret and the cunning of a rat_ * the thickets and barnyards of this country.,infesting,requires,tent,accompanied
Any \"surplus\" wild life is a public nuisance_ * should promptly be shot to pieces.,and,desirability,draining,stillhunting
It may be  however_ that like New York with the heath *_ they will arouse and virtuously lock the stable door—after the horse has been stolen!,hen,waking,colonists,retaining
This condition * in a number of states_ north and south_ especially south.,prevails,effectually,drainage,likes
On that day occurred the third annual gift distribution of raw materials designed * promote in the breasts of 2_000 children a love for birds and an active desire to protect and increase them.,to,exit,unlucky,tame
