Every * sportsman who is rich enough to own a private game preserve_ sooner or later acquires one.,true,reserves—unless,refuges,homes
A puma that escaped (about 1902) from * Zoological Park_ instead of being shot was captured by sensible people in the hamlet of Bronxdale_ alive and unhurt_ and safely returned to us.,the,thrush,cooked,argali
Nail up fat pork_ or large chunks of suet_ on the south sides of conspicuous *_ and encourage the woodpeckers_ nuthatches_ chickadees and titmice to remain in your woods through the long and dreary winter.,trees,denuded,expenses,instance
A few local exceptions will not disprove the general truthfulness * this assertion.,of,performed,repay,compositors
The * forests have mostly been swept away_ and safe shelters for small birds are very rare.,sheltering,middendorffi,extending,orioles
In those days I never but once heard of a policeman  on his own initiative  arresting a birdshooter_ even on Sunday; but whenever meddlesome special wardens from the Zoological Park * pointedly called upon the local police force for help_ it has always been given with cheerful alacrity.,have,fruit,governed,volumes
We * not \"limit the bag_ and enforce the laws_\" while we permit the makers and users of autoloading and pump guns to kill at will_ as they demand.,will,model,burnings,exterminating
The * was when the friends of wild life did not dare speak of this subject in Washington save in whispers.,time,gratitude,enabled,heron
If some * can not be found to curb that all-pervading propensity among our frontiersmen_ then we may as well bid all our open-field big game a long farewell; for the deadly \"residents\" surely will exterminate it_ outside the game preserves.,way,pitch,thickets,sharp
By some sportsmen it is believed that * long-continued killing of the finest and largest males_ the red deer of Europe have been growing smaller; but on that point I am not prepared to offer evidence.,through,blows,grizzlies,disturbed
Twenty-six states forbid by law the sale of  their own  \"protected\" game_ but twenty of them do  not  expressly prohibit the sale of * stolen from neighboring states!,game,cereals,motto,companies
In 1911_ the Iowa State University despatched to Laysan a scientific expedition in * of Prof.,charge,considerably,netted,resembling
Their preservation is distinctly a burden upon the countries of South America * lie eastward of the Andes_ and on Yucatan_ Cuba and the Bahamas.,that,gradually,forceful,lists
Let the British public and the British Parliament * no mistake about that.,make,never,constitutes,handed
Mrs. Nice publishes the entire list of 129 species of * seeds consumed by the quail_—and it looks like a rogue's gallery.,weed,recruit,suggested,feverish—sure
Song-bird slaughter is growing and *_ with the decrease of the game birds!,spreading,finding,dangling,line
In the well settled portions of the United States_ such species * quail_ ruffed grouse_ wild turkey_ pinnated grouse and sage grouse hang  to life by slender threads.,as,candidates,thirtyfour,colonist
This is * inevitable result of civilization and progress in wild lands.,the,disease—a,combination,savage
Adelaide_ is a peninsula * suited to the preservation of wild life_ especially birds_ and it is now a sanctuary.,well,caterpillars,times—and,women
Evidently it * not soon be exterminated by modern rifles.,will,fiveyear,salaried,shepherds
Originally this species inhabited \"northern Mongolia\" (China)_ but in a wild state it became extinct before its zoological standing became known to * scientific world.,the,adapted,consumers,markethunter
The Supreme Court of Pennsylvania (Judge Orlady) has decided that the Pennsylvania law against the use of automatic guns in hunting is entirely constitutional_ because * state has a right to say how its game may and may not be killed.,every,instance,editors,virtue
The number of armed * and boys who annually take the field in the United States in the pursuit of birds and quadrupeds_ is enormous.,men,shoot—and,budders,bellow
For ten long minutes he stood fire * flinching_ and without once opening his lips to speak.,without,invited,woodpeckers,witness
On account of the now-accursed land-of-liberty idea_ every foreigner * sails past the statue on Bedloe's Island and lands on our liberty-ridden shore_ is firmly convinced that  now_ at last_ he can do as he pleases!,who,stirred,suit,policemen
There are thousands of square miles so *_ so swampy_ so dark_ gloomy and mosquito-ridden that all men fear them and avoid them_ and in them rubber culture must be impossible.,boggy,persistently,paradise,woodlot
In New York and New Jersey_ in Pennsylvania for everything save the sale of heron and egret plumes (a privilege obtained by * bunko game)_ in Massachusetts_ and in many other of our States_ the wild-birds'-plumage millinery business is dead.,a,vastly,justly,gunusers
Night * is prohibited_ and female deer may not be killed.,hunting,recreation,mistake—common,continually
So far as waterfowl are concerned_ * could hardly be worse_ except by the use of punt guns.,conditions,motor,health,commissioner
In the winter and spring of 1912 the State Game Commission of Pennsylvania found * quail and ruffed grouse were being sold in Pittsburgh_ in large quantities.,that,libraries,allotment,midocean
And yet_ how many men are there to-day_ out of our ninety millions of Americans and pseudo-Americans_ who remember with any feeling of gratitude the part * in American history by the white-tailed deer?,played,recommended,boundless,survived
I suggest a perusal of the statements of the three Frenchmen who are quoted with such confidence * Mr. Downham and published by the Hon.,by,secret,gamehogs,crunching
The millions of the * world are upon us.,insect,yellow,treatment,maneating
However_ the subject can not be ignored simply because it * disagreeable.,is,you,butter,carcasses
We may safely assume that all lands well suited to agriculture_ mining and grazing will become populated by rifle-bearing men_ with the usual result to the * mammals and birds.,wild,foreigner,bontebok,prevent
The time to discuss tiresome academic theories regarding \"bag limits\" and different \"open seasons\" as being sufficient to * the game_ has gone by!,preserve,expeditious,tightened,readiness
Each *_ I think without a single exception_ does  some  damage_ chiefly in the destruction of valuable wild birds.,one,unlimited,park,perches
Inasmuch as all this is true_—and no one with information will dispute it for a moment_—is it not folly to seek to supplant our own splendid native species of * birds (that we never yet have decently protected!,game,unemotional,talked,hesitate
The killing of doves represents a great and widespread * in the ethics of sportsmanship.,decline,labor,lemurs,whitetailed
