” You see a donkey counts half a mule in caravan travelling_ just * a child counts half a person in train travelling.,as,child,gun,convince
* punishments are as topsy-turvy as the lessons.,The,egg,writing,sat
When * boy is caned he lies on his back and holds out his feet instead of his hands.,a,trusting,incredulous,real
Sometimes his feet are held in a kind * stocks while he is caned across the soles.,of,clay,write,twice
They call it \"eating sticks” or \"eating wood”—the words * the same.,are,tries,consent,filled
Some missionaries were picnicking one * in an orchard in a hill village_ and the village children gathered round to watch the foreigners’ strange ways.,day,condition,onwards,shouting
\"Do you often come and eat plums here?” one of the ladies asked and she was greatly bewildered by the curious tastes of Persian boys_ when the owner of the orchard answered for them_ that the boys who came into his orchard * not the plums but the wood.,ate,watch,The,hears
This beating on the soles of the feet is a common punishment for every one_ from * slave and the schoolboy to the criminal and the political offender.,the,let,brook,tent
With schoolboys it is of course not very *_ but in more serious cases it may be very severe indeed_ even resulting in death.,severe,more,Bibles,roads
The culprit in these cases is ordered not so many blows but so many sticks_  he is to * beaten till so many sticks have been broken.,be,No,salaries,larger
A hundred sticks is not an * punishment.,uncommon,herself,topsy-turvy,Morning
If the culprit is rich enough he may bribe the  to strike the stocks when possible and so break the * quickly_ and not over his feet but a poor man has to take his punishment.,sticks,population,drums,20
There is no compulsory education in Persia and very little * education.,free,naughty,alms,fashion
There was one man who tried to atone for sins_ which he made no pretence of giving up_ by founding a large free school in one Persian town_ but it is not a common * of benevolence.,form,ill-treatment,complimentary,usually
So it is only * who can spare a little money who send their boys to school_ and a great many never get beyond a very early stage of reading and writing.,those,mildly,offering,staff
As for the girls very few parents care to * their money over their girls’ education.,waste,bones,prayer-stone,ought
A certain number are taught to read the Quran_ a less number go on to reading such books as they have studied_ but very few can read at sight_ and writing * even rarer.,is,covered,joy,decided
Still in the matter of the education of girls * is in advance of other Muhammadan countries.,Persia,support,asked,fivepence
In these days of general education it is difficult for us to realise * this country how hard it is for the missionaries to teach the gospel truths to the Persians.,in,fit,Presently,stunted
There is so much to be taught and there are so many to be taught_ and when it has to be done orally to people whose intelligence and memory have never been developed by study of any kind_ whose minds and brains have never grown up properly_ and who forget so easily_ it means an amount of work that would take up all the time and strength of far more missionaries * are now in the field.,than,leaving,perhaps,weeks
Many of the converts cannot come regularly for oral teaching_ and they are liable at any time to move out of the missionaries’ reach_ so the missionaries try to teach all the converts and their children to read their Bibles at any rate_ so that they can get teaching direct from * Word themselves.,God’s,demand,garden,relapsed
Besides the Persian schools * are now several Christian schools in Persia_ but we will talk about those in the next chapter.,there,work,(Muhammad’s,prefers
Since they were started there has been an attempt in some of the big towns to introduce an improved system of teaching_ and Persian reading-books are now printed with _ _ *.,etc,animal,infectious,that
*.,etc,compound,distinct—each,recommend
but this is the exceptional method of teaching_ * not the rule in Persia_ and I doubt if any orthodox schoolmaster would care to teach Persian before he taught the Arabic Quran.,and,being,Armenian,tiptoe
The Parsees have a * good school in Yezd_ largely supported by the Parsees in Bombay_ but this is only for Parsee boys.,very,Europe,basins,poor
are two branches of mission-work in Persia that bring the missionaries into close touch with Persian * one is the hospital_ the other is the school.,children,binds,land,embroidered
You will hear about the medical work presently * this chapter we will look at the school work.,in,truths,control,Jews
But this is * all they want.,not,coppers,life?,drawing
As they get to know the Christians they see that there is something in English ways and English character that the * lacks.,Persian,Half,ending,languages
And they bring their boys * the missionary_ and ask him not merely to teach them English_ not merely to teach them book-learning of any sort_ but to teach them to be good boys.,to,Sacrifice”,Arabic,scarf
They do not so often ask for a girls’ school_ for they do not * a girl needs any book education as a rule_ and only a few of the Persian women can even read.,think,Fairyland,Arabs,appearance
Yet in some of the Mission-stations girls’ schools have been started with great success_ and year by year the demand for them is *.,growing,kites,death,religions
English is less taught in these schools_ but some of the girls * it_ especially those most closely connected with the mission.,learn,soldiers,that,\"How
The girls_ of course_ have to give a good deal of time * sewing and embroidery_ which are more necessary for them than foreign languages.,to,Surely,or,everything
But in all the Mission-stations sooner or later_ generally sooner_ a boys’ school is started_ and these schools vary very much according to the * of the different towns.,needs,refreshments,like,money
In one school Armenians and Muhammadans work side by side_ in another * find Muhammadans and Parsees_ while a third contains all three.,we,plaster,Europeans,dishes
In one school * English is taught_ in another advanced Persian and Arabic are added.,only,murderer,eager,friendless
In yet another_ everything is taught from the * alphabet onwards.,Persian,use,Year’s,reduce
One missionary works alone in his own house_ another * a full staff of Armenian and Persian teachers and monitors_ and a well-built convenient school.,has,daughter,Captain,occasion
But whatever the race of the boys_ whatever the subjects *_ whatever the organisation_ there are difficulties to be faced.,taught,consideration,punishment,extraction
It is difficult to get teachers sometimes none can be got * the spot_ and they have to be fetched from some other town_ perhaps several weeks’ journey away.,on,windows,question,ordinary
Sometimes the missionary has to be the only teacher till he can train some of his own * to be first monitors and then masters in the school.,boys,ever,fear,belong
Then there is * school itself.,the,well,We,behaving
Sometimes the small beginnings of a school are started in the missionary’s own dining-room sometimes he is able to spare a room entirely for * purposes.,school,uses,waste,fully
In one * this was supplemented by a rough tent or shed made of matting in the compound.,case,can,ideas,shade
But as the * grows_ separate buildings have to be found or built.,school,entreaty,appropriate,wither
Books are * difficulty.,another,lands,eye,medical
All books * teaching English have to be got from abroad_ and many are not suitable.,for,Husain’s,velvet,cheerful
Readers which are very suitable for the size of boy who reads them in England or India_ are not suitable for the young men who * use them in Persia.,often,breakfast,sugar-candy,thinking
If you give an * young man_ well read in the finest Persian poetry_ the childish stories and rhymes in many of the readers_ he thinks English books are very_ very foolish_ and his opinion of English intelligence in both literary and religious matters falls very low.,educated,models,all,pilgrimage
All these * need money.,things,cut,refreshments,Heavenly
The boys generally pay a very small fee and buy their own books_ but the fees do not go far towards paying for the schools and the teachers’ salaries_ and the getting together of * necessary money is another difficulty.,the,Having,read,tools
The pupils * present three great difficulties.,themselves,plants,individual,permission
In our country boys under fourteen generally go to different schools from boys over fourteen_ and * who wish to continue their education after seventeen or eighteen leave school and go to college_ or attend special lectures.,those,touches,position,ears
But in Persia the missionary is asked to take them all together * one school_ even middle-aged men wishing to become pupils.,in,weather,needs,Kerbela
But it is * impossible to make a satisfactory school of boys and men together.,quite,have,dissuade,earn
It is sometimes possible_ especially in the larger schools_ to * separately for the men_ but generally an age limit has to be set.,arrange,spread,working-class,yellow
The second difficulty arises from the number of boys who want to learn English and who are never likely to have any use * it.,for,tired”,mark,whitened
They have an idea that it is so new and uncommon that any one who knows it is bound to get work at a good salary_ and so they want to waste their time over it when they ought to be learning the subjects they * really need for their work.,will,hot,collected,model
It takes some time and trouble to sort these * out from those who are really likely to need English.,boys,beyond,silk,reduce
The third difficulty is not peculiar to Persia_ though * presents some peculiarities there.,it,pain,three,refuse
It is the problem * managing the boys.,of,bargaining,pity,unable
Boys in England_ I am sorry to say_ sometimes tell lies_ but in Persia it * be more correct to say that they sometimes tell the truth.,would,year,popular—the,square
Then again the boys are of different ranks some of them come with * servants_ and a certain amount of tact has to be used to get them to accept the ordinary rules of discipline.,their,frivolous,Perhaps,measured
But in a school where everybody comes * learn most of these difficulties can be overcome.,to,nigger,hungrier,tempers
Persian boys want knowing_ like all boys_ but when one tries to do one’s best for them one finds them thoroughly lovable and possessed of * large number of exceedingly good points.,a,v,household,hungry
Lastly_ the _ or Muhammadan clergy_ see in the schools the greatest danger to their religion_ * they oppose them strongly.,and,follows,Eve,inflammation
They know that such close contact with Christians must open the boys’ eyes to some extent to the contrast between Muhammadanism and *_ and they know Muhammadanism cannot stand such a comparison.,Christianity,comfortably,shouting,colours
Many Muhammadans_ who believe that Muhammadanism is a true religion given to them by God through Muhammad_ still see that Christianity is the better religion_ and Muhammadans have told me that God had given us a better religion * He had given them.,than,colours,own,widow
So the  try to persuade or frighten the fathers into not sending their boys to the Mission-school_ they try to frighten the boys out of going_ and they try to get the governors to close * schools.,the,vinegar,knee,Jericho
But it is God’s work_ and He does not allow them to * it for long.,stop,foot,appointment,energy
The * themselves show the greatest interest in whatever they are told about the Bible_ and naturally in one way or another Bible reading is always a prominent feature of every class of Mission-school.,boys,v,brings,new
Sometimes there is a regular lesson on the Bible as one of the school subjects_ but in other places there are no Bible lessons_ but only prayers and Bible-reading_ with * simple explanations.,very,selected,cry,monitors
But however this may be_ the gospel * of Christ Jesus_ which is known by name to every Muhammadan_ but by more than name to very_ very few_ is always of absorbing interest_ and is not likely to be forgotten.,story,object,water,neglect
the house of ‘Ali Akbar the pea-roaster_” I said to my *.,servant,absorbing,underfed,sandy
It proved to be the widow who had sent for me_ and * were soon great friends.,we,stayed,Finding,returned
\"And do you * to school?” I asked Husain_ a merry little boy of eight.,go,salary,sending,probably
\"No_ I am an apprentice-baker_” he said with an evident sense of importance he felt he was a wage-earner—a halfpenny a day_ I think was the amount_ but where * labourer often only earns fivepence a day_ even a halfpenny a day counts for something in the family.,a,sister,lacks,saying
Seven years old seems to be * very common age for apprenticing boys in Persia.,a,foolish,sunrise,Indian
A boy of that age can make himself useful and gradually learn his trade_ and if * master and his fellow-apprentices are kind he may be very happy_ like my little baker.,his,tastes,pole,gardens
He probably fetched and carried_ brought sticks for heating the oven_ laid out the long thin flat loaves in rows as they were handed to * from the oven_ and later carried them in a tray on his head_ or hanging over his shoulder_ to some of the customers.,him,collection,\"No,drums
Probably * Lord Jesus Christ Himself started work in the carpenter’s shop at Nazareth as soon as He could be of any use.,our,task,limiting,fails
He would fetch and carry tools_ sort out the nails_ help to clear away the shavings_ and later He would learn to hammer nails_ to saw and plane_ just as the little Persian apprentices do to-day_ and He would thoroughly * helping Joseph in the workshop and Mary in the house.,enjoy,bazaar,world,man’s
There was * little \"apprentice-carpenter” who looked such a baby he can hardly have been as old as seven.,a,repeat,see,breadths
He used to run back to the shop for tools or nails_ and hold the hammer_ and he even succeeded in pulling some nails * of a packing-case.,out,roses,shawls,baby
But his master was not always kind to him_ and sometimes beat him_ and he did * seem as happy as the baker boy.,not,dots,lasting,marrying
Servants will often bring their little boys to the house to * them in their work_ and gradually fit themselves for service.,help,God’s,wet,eternity
When they begin * be really useful the master generally gives them a small wage.,to,troubles,marvellous,dishonesty
A servant who has no boy of * own will often bring a nephew or a cousin.,his,learned,basin,brings
In every trade you find them_ little boys whose business it is to lighten their elders’ * a little in any way they can_ for the Persians are not over fond of hard work.,work,forced,too,intended
You find them too in the houses of poor people_ who cannot afford to keep a regular servant_ but pay a few coppers or a meal to a little boy to come in and make himself useful_ sweeping the floor and watering it in hot weather_ preparing * _ or hookah_ running errands_ chopping firewood_ and a hundred other things.,the,King,Mullā’s,teacher
It is a system that works very well when it is worked with kindness and consideration_ but it is * terrible system when it is abused.,a,imaginable,length,purposes
In the Persian carpet trade we see *.,this,\"sin”,This,plaster
In the villages the whole family works at one carpet_ and * the children grow old enough they are taught and made to join in the work.,as,girdle,skirt,men
There need * no cruelty in this_ and often the little things are only too proud and happy to do as their elders do_ and join in the family task.,be,compulsory,questioner,affairs
But unhappily even in the family there are many cases * cruel overwork and ill-treatment.,of,cleverer,rhythm,spread
But for the horrors of child labour in the * trade we must turn to the factories of Kirman.,carpet,doctors,religious,Good
These factories are filled * children from four years old upward_ underfed_ overworked_ living a loveless_ joyless_ hopeless life.,with,relations,positions,governorship
The factories are built without * lest the children’s attention should be distracted_ and the bad air_ want of food_ and the constantly keeping in one position produce rickets and deformity in nearly all.,windows,sun-dial,fork,teaching”
Of thirty-eight children examined in one factory thirty-six * deformed.,were,workshop,authorities,especially
One of the Governors of Kirman forbade the employment of children under twelve in the factories_ but the order did not * beyond his governorship.,last,resist,hill,condole
The same Governor gave the order still in force_ which forbids the employment of children before dawn or after sunset_ thus reducing their working hours to an average of twelve hours a *.,day,Jericho,exciting,polishes
A recent Governor added to this an order limiting the Friday work to about two and * half hours_ \"from sunrise to full sunshine_” so now the children share in part the general Friday holiday of Muhammadanism.,a,All,insisted,proverb
One of our medical missionaries was called to attend * wife of the owner of one of these factories_ and consented to do so on condition he made windows in his factory to allow the children air and light.,the,continue,journey,Jericho
He objected at first_ saying that it would prevent their working_ but * consented_ and admitted afterwards that the children did more work with the windows than they had done without them.,finally,vigorously,burn,or
The factory owners are glad to * the children_ for they say children work better than grown-up people at carpet-making_ and of course they expect less wages.,get,newcomer,title,mudwalled
But how can the parents allow their children to live this cruel life? You will find the answer in * Persian saying that \"of every three persons in Kirman_ four smoke opium.,the,pillows,entertainments,pasture
The man who takes opium regularly becomes a wreck first his digestion * ruined_ then his heart gets weak and he get bronchitis and other chest troubles_ and he become unreliable physically and morally he is untruthful and deceitful_ and when he is once well under the power of the habit_ he goes almost mad if he cannot get his opium at the usual time_ and would sell his soul for it_ and does sell his children.,is,official,missed,carpet
Over and over * comes the terrible story_ the father and mother smoke opium the little deformed child toils through the long days to earn the money that buys it.,again,alike,broad,bring
In the villages the children begin almost as soon as they can run about to take out the sheep and goats_ not in * fields_ for there are none_ but among the scattered plants on the mountain-side or under the village trees.,green,easily,teachers’,Yazdigird
Only the boys are allowed * take the flocks out on the hills at any distance from the village_ and on mountains where there are thought to be wolves_ even the boys are forbidden to go without a man.,to,trusting”,dispensary,selected
But in and around the villages * and girls alike turn out.,boys,Jews,should,shoe
Often they carry a long pole_ * more than twice as long as themselves.,generally,She,official,Year’s
This pole serves at times as a fence to keep the flock from * into crops as they pass them on their way_ or as they graze on the stubble of the neighbouring crops which have been already gathered in.,wandering,herself,explanations,third
The stubble itself is not much_ but there are more weeds there because the ground * been watered.,has,advantage,breakfast,kept
But neither on the hills nor in the fields can they find much pasture in the heat of summer_ so the little shepherds and shepherdesses take their flocks under the trees and beat * leaves down with their poles for the animals to eat.,the,settle,edition,son’s
When the lower leaves are finished they climb_ * and girls alike_ into the trees_ often to considerable heights_ and beat the higher branches.,boys,preparing,round,engraved
The leaves that are not eaten are dried and kept for the winter as we * hay.,keep,us,displaying,tradition
It is an awkward thing for a child to climb trees encumbered with a long pole_ and in the districts where they do this * are often accidents.,there,Boys,heard,voice
One little boy of eight or nine was brought to the Yezd hospital with a * compound fracture of his skull through falling out of a tree while tending the sheep.,bad,young,War,engagement
He got nearly well_ and then his mother took him home_ so I do not know whether he fully recovered * not.,or,Here,When,orange
Among the richer classes the * sometimes undertake nominal work at a very early age_ but not actual work.,children,during,exception,apprentices
One boy of about sixteen in our school held a position * the Persian army corresponding to that of Colonel_ and there was said to be a Field-Marshal of twelve in the army.,in,character,five,thirty-six
Merchants consider it good training for their sons to do a little business on their own account_ and some * our schoolboys imported goods from Bombay or elsewhere while they were still at school_ and disposed of them at a profit.,of,Bombay,Presently,savage
Persian girls stay at * longer than the little apprentices_ but not so long as the richer schoolboys.,home,Arabian,faced,condole
The usual age for a Muhammadan girl to marry is thirteen or fourteen_ but in many * they marry as early as eight or nine.,places,bent,twice,consulted
* perhaps explains why the girl is given no voice in the choice of a husband_ and all is left to the parents.,This,yard,love,tots
It perhaps partly explains too why Muhammadans are allowed to beat their wives_ * they will tell you_ as a proof of their prophet’s kindness to women_ that he forbade them to do it with a chain.,though,hill,bright-patterned,stocks
A little girl who has not had time to grow up and learn to behave herself_ will * no doubt be difficult to control.,often,dissatisfied,breadth,\"arose
The young wife of a shoemaker one day lost her temper * her husband said he could not afford to buy her something she wanted.,because,valley,lump,beginnings
She proceeded * break all the ornaments in the house and to tear her best  to rags.,to,Governor,the,tank
Her husband_ who was a Christian_ went * the English missionary to ask whether it would be allowable under the circumstances to beat her.,to,pressing,every-day,pair
Another girl refused to cook her husband any food when he came home from his work_ and would not even speak * him.,to,together,religions,fuel
She admitted * he was very kind to her_ and that she liked him better than her own brothers_ but still continued to sulk in this way.,that,absence,roads,tradesmen
Her own relations said a good beating was * she wanted_ but her husband had scruples about wife-beating_ and would not do anything.,what,habit,needless,towards
But not many * husbands are so forbearing.,Persian,adding,details,study
Another necessary result of * early marriages is the custom of living with the husband’s parents.,these,opium,insisted,say
A girl of even fourteen is not fit to be * sole charge of a house.,given,saint,answer,shoes
So the bridegroom takes his bride home to * father’s house_ and puts her under the charge of her mother-in-law.,his,teachers,\"Festival,egg
When_ however_ the mother-in-law becomes a widow_ she has to take a secondary place_ if * daughter-in-law is at all of an age to manage her own affairs.,her,own,burnt,rows
Then the old lady often prefers to leave her son’s house_ and to go and live with a married daughter_ and the men are generally very good in taking in their *.,mothers-in-law,girls’,belt,glasses
Poor little girl wives! They are * away from home before they are grown up_ and although they are now married women they cannot help behaving as children.,taken,meals,beggar,Mullā’s
There was one young wife of a Government official who received her visitors with the utmost dignity and propriety_ and then could not resist * temptation to pinch the old black woman who was handing the tea and make her jump.,the,exceptions,over,object
And they hardly know what to do with their *.,babies,stubble,forbidden,loaded
They love to nurse them and play with them_ but they get very tired of them and are often * to hand them over to the grandmother.,glad,grow,giving,sand
I went * condole with one girl on the death of her dear little baby_ and she said_ \"It was just as well it died before the winter.,to,plastered,\"rounders”,Yes
It would have been such cold work getting up in the night to look after *.,it,sunrise,upstairs,orphan—there
Even when the children grow older their mothers_ grown-up children themselves_ do not know how * manage them.,to,rode,dip,literary
What do you think of mothers who lose their tempers with their children_ and fly at them and bite them? And they are not ashamed of it_ * their neighbours do not seem surprised or horrified.,and,570,temper,folks
One woman bit her little boy’s hand_ till it bled *.,badly,sherbet,demand,preference
* was about seven_ and had cried to have his best coat on when he went to see the missionary.,He,alphabet,delightful,Have
Another woman bit the cheek of a poor little consumptive girl of * or nine_ so that there was a great bruise_ and the skin was broken.,eight,offering,animal,enjoy
She told a neighbour_ with a laugh_ that she had got * with the child because she was tiresome about taking her medicine_ which was very nasty.,angry,above,tried,follows
There is no command in the Quran that girls should be married so young_ but the mothers declare that it was the command of Muhammad_ and certainly he himself set * example by marrying a girl of nine.,the,follow,son’s,Very
