This is a book about Persia_ intended to be read by children and_ on * account_ much has had to be left out.,this,pain”,break,hair
Do not think_ when you have read this book_ that you know how bad Muhammadanism is_ for a great deal * its sin and cruelty is too terrible to tell to young folks.,of,moving,pass,careless
But I hope enough has * said to show you that Persian children do need to be rescued from Muhammadanism and brought to the Lord Jesus Christ to be His children.,been,\"Oh,ailment,worshipped
He needs them and they need *.,Him,windows,different,baby
So for His sake and * we must do all we can to win the Persians for Christ.,theirs,Turkish,Ahmad,wall
we look at the Persian children of to-day_ let * go back nearly thirteen and a half centuries to the year of our Lord 570_ and take a look at two adjoining countries in Europe and two adjoining countries in Asia.,us,hen,turns,inside
In Western Scotland_ St Columb is teaching the people Christianity_ and is * out copy after copy of the Bible_ until tradition tells that he copied it out three hundred times.,writing,knee,walled,Arabian
In England the heathen Saxons are conquering the Midlands and crushing out the * of the Britons.,Christianity,walk,which,listening
In Persia there is a Christian Church_ but most of the people * Zoroastrians_ that is_ they belong to the Parsee religion.,are,finally,each,despair
They worship God and believe in a prophet * Zoroaster_ who lived long before the birth of our Lord Jesus Christ_ and so knew nothing about Him.,called,Still,bright,presently
* seems to have taught his people much that was very good_ but their religion has become full of superstitions.,He,accordance,New,heated
Lastly_ we must go to Arabia_ where a Muhammadan legend describes * curious scene.,a,it,epidemic,dictated
A number of Arab women are * into the town of Mecca.,riding,exposed,Bibi,fast
Their animals are weary and very * and weak_ for it is a year of famine.,thin,35),born,waiting-room
Last of all comes a woman * a crying baby_ riding on the thinnest and most miserable looking donkey of all the company.,with,divining—turned,hundred,dead
They are nurses from the healthiest part of Arabia_ come to find children to take home and nurse_ each hoping to get * child of a wealthy man_ who will pay her well_ and give her handsome presents.,the,grace,meal,badly
They * not long kept waiting.,are,restricted,smoke,admire
The babies are brought out_ * questioning and bargaining begin.,and,wonderful,closely,apart
One baby is not popular—the whisper goes round that it is an orphan—there is no * to give presents—the grandfather who is looking for a nurse will surely not do much for it.,father,finally,wind,arrived
And so one after another all the women refuse the baby_ * the old man begins to despair of success.,and,\"And,abused,safe
All the women * found nurslings except one_ the woman who rode in last.,have,rosewater,from,welcome
She_ too_ has * the orphan_ but now_ seeing no hope of a better bargain_ rather than have taken her journey for nothing_ she tells the old man she has changed her mind_ and carries the baby home.,refused,who,happy,Muhammadanism
And the story runs that the thin weak donkey that could hardly drag itself along as it entered Mecca_ ran along * nimbly on the way home that the rest could scarcely keep up with it.,so,alms,joy),deal
The orphan * was Muhammad_ the founder of the religion called after him Muhammadanism.,baby,teaching,begins,remainder
Some of the details of this * (told by a Muhammadan writer) are probably quite untrue.,story,collected,us,inside
Little Muhammad’s grandfather was known to be very rich and in a very high position_ and if the baby was refused it was probably because he was a sickly child_ and would be difficult to *.,rear,bent,teachers,tiptoe
However_ in due course he grew bigger_ and came home to his mother_ and * her death lived with his old grandfather_ who thought all the world of him.,after,parents,Persians,hospitality
Mecca was an interesting town to live in_ for once a year pilgrims from all parts * Arabia came to the great idol temple_ and little Muhammad would see all there was to be seen_ for his grandfather kept the keys and superintended everything.,of,hill,degree,Over
When his grandfather died he went to live with his uncle_ who used to take him on business journeys_ going through the wide * to distant towns with long strings of camels loaded with goods to sell.,deserts,wipe,thin,required
So the boy grew up a good man of business and saw much of foreign countries and something of foreign religions_ Christianity_ *_ and Parsiism_ and he grew discontented with his own country and his own religion.,Judaism,woke,Christ,cheeks
All the * peoples round worshipped one God.,great,measured,Finally,ears
Surely Arabia would be a better and greater country if it * the same.,did,course,distracted,tradesmen
All the * religions had a prophet and a book.,great,”,hold,Sacrifice”
The Christians had Jesus Christ and the Gospel_ * Jews had Moses and the Law_ even the Parsees had Zoroaster and his book the Zend Avesta.,the,smoke,nurses,too—straightened
* what the Arabs needed was a prophet and a book.,Surely,joy,brought,preparing
Muhammad was not the only * who thought this.,person,suggest,told,worked
* was a group of people_ several of whom were relations of him or of his wife_ who shared this view.,There,among,headkerchief,streets
Some of them thought that Moses and the Law would be best for Arabia but many of them saw that * Christ and the Gospel were what they needed_ and most of these in the end became Christians.,Jesus,Hundred,reaches,visits
If Muhammad had joined them_ the history of the world from then * now might have been very different.,to,spoilt,lend,frockcoats
But Muhammad had set his heart on an Arabian * and an Arabian book_ and the more he thought of it the more sure he felt that this was the real way to unity and greatness for Arabia.,prophet,Yazdigird,horizontal,sheep
He himself belonged to the family which took the lead in religious matters in Arabia_ he had always been made much of_ and told he would be a great man he used to have fits which seemed to him and to others to mark him out as something out of the common so it is not surprising that he at last came to believe that * was to be the new Arabian prophet who seemed to him to be so badly wanted.,he,aside,ones,too—straightened
His fits began to take the form of visions_ and he believed that the words * the longed for book were being revealed to him.,of,gum,countries,enough
But it was a long time before he came forward publicly_ and when he did * was a good deal laughed at_ and only a few became his followers.,he,two-inch,jump,dreamed
Then he got an invitation to the town of Medina_ * he had a number of cousins.,where,For,teaspoonfuls,tools
The people of Medina were very jealous of Mecca_ * all_ whether they believed in him or not_ joined in giving Muhammad a great welcome.,and,Isfahan,Inconsistencies,offering
It was in Medina * Muhammad really founded his religion_ and there he became a very great man.,that,petitions,weighed,inkpot
But sad to say_ as his religion developed all its bad points came out_ and Muhammad became a very cruel tyrant and very self-indulgent_ excusing himself by saying that God * him_ because he was a prophet_ to do things which were sinful when other people did them.,allowed,with,no,hasten
The people who joined Muhammad’s religion were called Muhammadans or Muslims_ and they went everywhere making as many converts as they *_ by fair means or foul.,could,despair,cranky,offer
They had learnt that there was one God_ but * knew nothing of the Bible they only knew the Quran_ the book which Muhammad was revealing_ and they knew nothing of the example of Jesus Christ their only example was Muhammad_ who was a murderer.,they,bedding,underfed,strike
You may wonder what all this has to do with * children.,Persian,really,Father,arrangements
One of the first countries conquered by the Muhammadans * Persia—and the Persian children to-day are themselves Muhammadans.,was,buildings,missed,Babi
is a story that when the Muhammadans took Persia and killed the Parsee king *_ their  ‘Omar asked Yazdigird’s son where he would like to live.,Yazdigird,fracture,muleteers,prominent
He * he would like to settle in Persia out of reach of any cultivated spot.,said,ailments,carroty,matting
‘Omar accordingly sent him off * an escort of soldiers to find a suitable place.,with,(Praise,widows,packing-case
After three years he returned and said he could not find * place such as he had asked for.,any,Rubabeh,sweetmakers,plain
‘Omar saw that he was doing all this with * purpose_ and asked him what it was.,some,widow,mother-in-law,sees
Yazdigird’s son answered that he wanted to show ‘Omar how prosperous and well cultivated the * had become in the hands of the Parsees_ and begged him to see to it that it remained so under the Muhammadans.,land,please,missionaries,sorts
But it did not_ and to-day a great deal * Persia has relapsed into desert.,of,hands,publicly,pain
In our country all is green_ and * have to be put up to show where one village ends and the next begins.,stones,belt,finished,content
In most parts of Persia you may look over the plain and see the villages quite distinct—each a little green * on a vast sheet of sand or dry earth.,blot,secret,lying,stiff
The very fruitfulness of the ground makes it less green than it would otherwise have to be to support the population_ for when three crops can be got off the same piece of land in one year_ only a third of the * of land that you would expect to be needed to support the village is under cultivation.,amount,snow”,questions,brother
The villages vary very *.,much,donkey,leaving,path
Some count * population by hundreds_ while one village_ marked on the map_ contains just two families_ seven persons in all_ including two children.,their,last,tired”,thank
Their nearest neighbours live * miles off_ over the sand.,six,daughter,gallery,necessary
How bare the * must appear to those two little children.,world,tea-drinking,she,Missionary
Children here who live in the country * hardly imagine any boundary to the wonderful green tangle that they can see on every side of them.,can,possibility,medicine,years
And children who live * towns look out every day upon wonderful human works_ which_ although they are not as marvellous as God’s country_ yet puzzle them very much as to how they were ever made.,in,packing,news,tank
With a Persian * it is quite different.,child,drums,\"evil,excusing
In many places the children do not know what wild growth *_ and if you talk of continuous country_ hundred miles after hundred miles of field and wood and meadow_ they think you are telling an impossible fairy tale.,is,backslide,chests,run
While as for the little town children_ the buildings which they see all * them made of sun-dried bricks and earth_ the barrels and the thousand and one household utensils formed of exactly the same material_ or perhaps of clay very roughly baked in a primitive kiln_ seem to them hardly more artificial and man-made than the corn in the walled gardens outside the city_ which they see watered twice a week.,round,pilgrimage,exactly,piece
They have a very * life from you and me.,different,mile,combinations,driven
He lived in a really beautiful house_ built of sun-dried bricks and clay_ and whitened * with a smooth coat of plaster of Paris.,inside,loud,lives,prepared
The rooms were large and very nicely furnished with beautiful Persian carpets_ and a mattress and pillows of gay designs_ and Ahmad_ little rascal though he was_ would never have dreamed of treading on those carpets with his shoes on all shoes were left * the door.,at,edition,midday,drew
One small table * the tea-urn completed the furniture.,for,text,persuade,snow”
And upstairs? Upstairs was the roof_ such a lovely large flat roof_ Ahmad loved it_ and he often terrified his mother by the way he leaned over the low wall to look down * the street_ for the house had no window looking to the road.,at,loveless,quarter,possible
All the windows looked into the garden_ which might be * to be in the middle of the house_ for the rooms were built round it.,said,it,tiers,needless
The windows_ too_ were all doors some of the rooms had as many as five double doors all in a row_ and when they were all open the room was very airy and *.,bright,up,excitement,rhythm
There was no grass_ and no gravel path for Ahmad to play on_ but there was a nice wide brick-paved walk all round the garden_ which gave him plenty of *.,room,favourable,useful,change
In the centre were the beds_ which were watered by turning a stream in and flooding * once a week.,them,crowd,velvet,tying
There were watering cans_ but they were only * for watering the path and roof_ and even the rooms_ to keep them cool_ not for the flower beds.,used,bed),chair,fence
There was a large tank_ too_ in the garden with gold fish in it_ where * loved to cool his feet on a hot day_ and the days can be hot in Persia.,Ahmad,voice,began,charcoal
When it was dinner-time in Ahmad’s home a cloth was spread on the floor_ and he sat on his heels beside it_ and had a loaf of bread for a *.,plate,Mary,consulted,missed
It was flat and round_ and about as thick as a *_ so it did very well.,plate,boxes”,realise,difficult
But he had no spoon or *.,fork,enter,Muhammadans,tending
One of the things he liked best was rice_ and when his mother put a few handfuls on his bread he would eat it quickly and tidily with one hand_ without spilling any_ which is not as easy * it sounds.,as,My,according,ass
Sometimes Ahmad went out for a walk in the town with his father_ or with his mother and a servant_ and he passed along streets that had not any names_ and by houses that had not * names or numbers.,any,dry,population,main
There was no pavement except sometimes a narrow strip in the middle of the road for * mules and donkeys.,the,pinch,rosewater,tables
There were no gardens in front of the houses_ there were no windows facing the road_ all he saw was a * road with a high mud wall on each side_ and a heavy wooden door here and there_ the front door of a house.,sandy,enclosed,feathers),magnet
Sometimes they came * a \"” or street of shops.,to,Kirman,pointing,baggy
Here the street * covered over with a mud roof so that goods and sellers and purchasers might keep cool in hot weather and dry in wet weather.,was,taking,ordered,alms
He did * need to go into the shops_ for the counters were all along the street and there were no windows.,not,Æsop’s,table—and,schoolmasters
When the summer * getting very hot_ it was decided that Ahmad and all his family should go for a summer holiday to a village in the hills.,was,handing,red,connected
What a packing up there was! They packed the carpets_ they packed the beds_ they packed the * and saucepans.,kettles,\"Festival,loved,receive
Then a number of mules were brought to the door and such a shouting and bustle began as the loads * roped together_ two and two_ and slung across the big padded pack-saddles.,were,poems,brass,works
One mule carried two * covered panniers and these were filled with cushions_ and Ahmad’s great-grandmother got into one_ and his mother got into the other to balance her_ and they pulled the curtains well over the front_ so that no one might see them.,great,right”,together,day
Ahmad himself sat in front of a servant who held him safe_ and some of the bedding made a nice broad soft seat for them on the mule’s *.,back,stretching,methods,only
At last all the mules were ready with their loads and off they set through the streets_ and * they found themselves outside the town_ going mile after mile across the bare desert plain.,soon,worse,late,screams
This * on for fifteen miles and then they reached a large village at the foot of the hills.,went,lessons,England,bodies
They had been riding five hours and were tired and hungry_ so * dismounted at the  or inn.,they,mothers-in-law,lasts,load
One of the servants took a carpet off one of the loads and got a cloth and some food wrapped up in a large handkerchief out of the saddlebags and spread a meal on the ground_ while another got the tea-urn and charcoal_ boiled * water and made the tea.,the,rolled,missionary,found
After a few hours’ rest * the roof_ the shouting and loading began again and off they went_ up the hill_ which was terribly steep in some places.,on,brothers,doubt,trade
Now they saw scattered and stunted plants growing here and there_ and finally_ after another seven hours_ they reached * summer holiday quarters in a little hill village.,their,three-quarters,Christ,din
* Ahmad enjoyed the hills and fields and trees_ the flowers and birds and butterflies.,How,foul,vain,herself
A little brook ran down the valley and on either side were cornfields and orchards and gardens_ * many as the brook could provide water for.,as,while,pots,braid
And at night Ahmad would hear the shouting_ * ‘Ali Muhammad declared that Husain had had his fair share of water and now it was his turn to have it for his orchard.,as,unity,knee,signs
For water is very * in Persia_ and must be made the greatest possible use of_ day and night alike.,precious,son,stars,Western
But the little children who live in the village are not so fortunate as little *.,Ahmad,goes,fine,streets
They work all the summer at gardening_ shepherding_ and other work but in winter they have to stay in_ * they live upstairs and their sheep and goats downstairs.,and,fever,kill,tend
But * stairs are outside and sometimes it is too cold for them even to go down to feed the animals.,the,owner,pearls,fourteen
If they can they make a little fire of sticks in * oven_ which is only a deep_ round hole in the floor_ and when the flame has died down they sit round with their legs hanging into the oven and cover over the opening to keep it warm as long as possible.,the,spare,third,\"I
One very severe winter there was a report current in the town that in this village the water was all frozen and that the animals were dying because there was not enough fuel to melt * ice and give them water.,the,100°,talk,under
The poor children must have had a very hard time that *.,winter,flower,Hop-scotch,fork
Even in the * Ahmad is one of the fortunate children.,town,accordingly,services,weigh
Little Soghra had a very * home.,different,blows,shyness,temple
She lived with * grandmother in a single small room.,her,heaven,spout,mouth
The floor was *_ covered in one place by a small ragged piece of coarse matting.,mud,inn,show,looking
On this the grandmother lay_ for * was old and ill.,she,remarked,Yezd,Certainly
The * were filthy and torn.,bedclothes,high,floor,\"We
One side of the room was filled with a pile of pomegranate *_ which are used for making dye_ and there were several fowls wandering about.,skins,she,hot,the
There was no furniture_ nothing * a few old pots and cups and a waterbottle.,but,rosary—many,The,heartbroken
And yet Soghra was a cheery little girl_ and * and her grandmother were very fond of each other.,she,played,fast-month,long
baby—what a funny little mortal! It looks for all the world like a little mummy_ rolled up in handkerchiefs and shawls till only its little face peeps out_ and tied up with a long * of braid exactly like a parcel tied up with string.,strip,working,health,looking
Hasn’t it got any * and legs? Oh_ yes_ safely put away inside all those wrappings and put away carefully too—straightened out and rolled up so thoroughly that it will stand up stiff and straight against the wall though it is only a week old.,arms,Christians,forgets,eternity
How surprised and shocked the Persian mothers * to see the English babies kicking and throwing their arms about.,are,soap,Husain,surprised
So at its very start on life’s journey the poor little Persian baby is checked and prevented from growing up properly for how can its little legs grow strong without kicking? It is no wonder that Persian babies as a rule learn to * much later than English babies.,walk,insisted,Quran,shall
But perhaps the Persians are not quite so * as they seem when they roll their babies up in these stiff little bundles.,foolish,similar,hungry,secure
Very likely the little arms and legs  be broken or bent if they were left loose_ * many of the Persian mothers are very young—much too young to know how to look after babies.,for,provides,hungry,foot
* often treat them like dolls and would very likely break them just as English girls break their dolls.,They,mouth,to-day,handkerchiefs
Even the * mothers are often very careless.,grown-up,books,trousers,skirted
One woman I knew laid her baby_ not quite a year old_ on a chair_ and left * there.,it,suffer,complaining,stop
Of course it fell off—it was sure to and yet she did this over and over again_ and a few days later dropped it into a stream of *.,water,secure,American,Scotland
She was very much surprised that it began to have fits at this time_ and * said she could think of nothing to account for them.,she,washed,ankles,can
A new missionary_ who did not know the ways of Persians_ went one day to see another woman and found her in bed_ that is_ lying * a mattress on the floor under a large quilt.,on,cap,fortunate,persuaded
Her friends invited the * to sit on the quilt beside her_ for they do not use chairs in most Persian houses.,missionary,complaining,can,nor
After she had sat for some time she enquired for * baby.,the,supper,drawing,occasionally
They pointed to a little lump in * quilt_ and there_ close beside her_ entirely covered up and invisible_ was the baby_ and it gave the poor missionary a terrible shock to see how near she had been to sitting down upon it.,the,turn,comes,chances
After that_ she always asked to see * baby before she sat down.,the,rules”,drops,laid
A baby less than a week old was brought one day to * Julfa hospital with its face badly torn by a cat.,the,away,calamity,grew
A few days later the doctor went into * ward and found the mother smoking and gossiping with the other women_ but the baby was nowhere to be seen.,the,refusing,girl,Arabian
\"Where is the baby?” \"It is all right_” said the mother \"I * it .,put,positions,weak,play
” And sure enough_ a little way off_ under a bed (this time an English bed) lay the poor little bundle_ its arms bound to its sides_ only its little face exposed_ or rather half-exposed_ for the * half was covered with a dressing_ while close at hand there prowled in search of food a large half-wild cat_ which frequented the hospital and had slipped in at an open door.,torn,refrain,few,tipcat
When they get a little older the babies are laid in broad comfortable leather hammocks slung between rings let into the walls of * room.,the,tiptoe,minute,owner
Most Persian rooms * these rings in the walls.,have,plate,push,still
These hammocks save the Persian mothers a great deal of trouble_ for a single push will set * hammock swinging for a long time and keep the baby quiet or send it to sleep.,the,near,count,destroyed
No baby may be left alone in * room till it is forty days old.,a,sight,devout,publicly
From the very first the baby is given  every-day_ that is_ something * make it sleep this  is almost invariably opium.,to,Bibles,Italian,thin
After the first week most babies are also given tea every day_ without milk but * a great deal of sugar in it_ or better still sugar-candy.,with,power,There,shoulder
This is * specially good for babies_ but it takes a long time to dissolve.,considered,peeps,deliberately,helping
Both * and tea are very bad for the baby’s digestion_ so we are not surprised to find that nearly all Persians suffer from indigestion.,opium,Colonel,Such,taking
There is one Persian custom connected with babies that boys and girls of other lands would probably like * introduce into their own country.,to,grown-ups,beggar,The
The newly-arrived baby is weighed and its weight in sweets is * round to the people in the house_ and it is supposed to bring bad luck to the baby if anyone refuses its sweets.,handed,oppressed,18,paid
Plenty of * always drop in when they hear that a new baby has arrived.,people,pull,pile,Wise
Another Persian rule for babies would not please * mothers at all.,your,women,new,Such
After the first bath no baby must be washed all over till it is a year *.,old,day-clothes,short,tied
One Persian lady_ who was better educated than most_ and had been reading about European ideas on health and *_ told the missionaries that she was bringing up her little boy just like a European baby.,cleanliness,flee,necessarily,man-made
She said she gave him a bath every day and generally let him kick instead * tying his legs up to make them straight.,of,room,proverb,house
She was delighted and triumphant when_ instead of getting crooked_ his legs grew so strong that he walked at about * the usual age.,half,folk,younger,pen
But when he was nearly a year old his body * covered with sores and the missionary doctor told the mother to wash them not with ordinary water in the bath_ but with a lotion.,became,guess,hospital,turned
* should never think of washing them in the bath_” she said.,\"I,fishes?,mile,Most
\"His body must not be * till he is a year old.,washed,never,waterbottle,lines
” * I thought_” said the doctor_ \"that you gave him a bath every day.,\"But,listen,good,fluffy
” \"Oh * no_” she replied \"I don’t wash his .,dear,charity,title,everyone
It is his  that * wash every day.,I,rhythm,understanding,\"Oh
When a Persian baby learns to talk it begins just like any other baby_ so that the Persians declared with great glee that the English babies were talking * when they said \"Baba” and \"Dada.,Persian,you,counters,coat
