Rawn did * know or note it.,not,scabbing,leaped,shops
* of the International got a new credit as a person of taste.,Rawn,policemen,radiance,ten
As to the house itself_ it combined Japanese_ Colonial and Elizabethan * in nice modern proportions_ the architect having been resolved to earn his fee.,architecture,awkward,secrets,So—well
The splendid animal_ the galloping * which is now in use_ has taken hundreds of years to make; it is unfair to expect_ therefore_ that any great improvement of our old stock_ or the making of an entire new breed_ can be accomplished off hand.,machine,drank,machinery,responsibility
His spelling_ not of the best in the belief of others_ seemed to him quite * enough_ because it was his own.,good,continued,anywhere,torments
Our superintendent_ *. Halsey here_ tells me that he is having a great deal of trouble in labor matters.,Mr,crept,cogs,pity
* came the second part of the ghastly drama.,Then,describe,presence,Lord
It might with some justice be urged that_ thus far in his *_ Mr. Rawn has shown little to distinguish him from his fellow-men; that indeed his career has been commonplace almost to the point of lack of interest to others.,life,telling,us,placed
Laura Rawn said nothing at the time_ being a woman * large self-control.,of,vehicle,enemy,about—after
The president of * railroad left for New York yesterday.,this,figuring,entrance,unseemly
He was a handsome_ stalwart young *_ but in some way his face did not look happy.,man,left,Threading,punish
After * moment's hesitation the girl stepped to the door and spoke to the maid.,a,shut,chapll,smell
But you've tried that_ and you know * you ended.,where,Rubber,aflame,decision
Ready money betting * been declared illegal.,has,Vellum,adduced,official
During * period of office_ to which they are nominated by their predecessors_ the stewards address those who are interested in the sport of horse-racing through the official \"Calendar_\" which is published in London by the Messrs.,their,so,ninety,Apology
Neither * it speak to him.,did,week,tightened,devout
There were smaller boys than he_ * these feared him by reason of the valor which it was supposed he owned.,but,good,mechanic,less
At Doncaster no individual or private company reaps the * of the moneys paid for admission to the stands and rings; the sums drawn_ it is understood_ go to benefit the town.,benefit,occasionally,Tuesday,shes
A hundred times a week he walked to his young wife_ caught * in his arms_ uxoriously infatuated with her youth_ her beauty_ her aplomb_ her fitness for this life which he had chosen.,her,masses,feed,pages
* said I could put in the scrap heap every factory run under the old and obsolete power methods.,I,fragrance,wrought,suckers
The ingenuity and industry expended on what is * 'tipping' in connection with horse-racing ought to bring good fortune in no halting measure to the professors of the art_ who appear to spend their lives in trying to enrich everybody but themselves.,called,lightweight,holiday,starters
Rawn's voice_ harsh_ * animal in its savagery_ wakened some sudden kindred savagery in young Halsey's soul.,half,Gents,kicked,dog
Would you tell him to have it * the door in fifteen minutes?  Then come back.,at,hole,merchant,endowed
John_ * I think it buys about as little as anything you can think of!\"  She gulped just a little in her thin throat.\",sometimes,welfare,create,cradle
The young man still looked at *_ still withheld comment.,him,us—well—it,poor,suspecting
It is known that a jockey_ if not careful as to work and diet_ will increase from twenty to thirty pounds during the winter season; but_ by taking vigorous exercise_ \"buried in flannel_\" he can come * to his proper weight in about twenty days.,back,matched,longdistance,artful
Others_ again_ less able in their profession_ or less fortunate in the ability or stamina of the animals entrusted to their *_ do not make so good a show with their horses_ and are consequently not looked upon with the same favour by the racing community.,care,commercial,Chanticleer,Arabian
Another feature of the past may * alluded to.,be,Purves,plenty,Lagrange
Perhaps there was something not wholly * in the bond between them_ since now it enabled them to talk_ one soul with the other_ almost without words.,unworthy,touch,theirs,nobly
The ambition * the soul.,shapes,factory,brooked,room—where
He * looking at her_ frowning_ uncertain.,stood,hope,John,this—the
* dollars!\"  She flung out the words scornfully.\",Thirty,understood,berth,retraced
To R*wn it seemed that he smiled because he saw the solitary attitude of a man as good as himself_ as fit as himself for all the insignia of power_ yet publicly self-confessed as lacking all such insignia.,a,seeking,Whatever,begun
*_ touts_ jockeys_ judges_ and starters_ all must submit to \"the stewards_\" whose words are law.,Trainers,conditions,unto,friendly
Somewhere_ he was hastening * his home.,toward,basis,these—they,sidelong
Under such circumstances_ it is consoling to those interested to * that \"the man in the box\" is above suspicion.,know,shouts,Surely,supporting
These are things that can't * altered.,be,ranks,giants,prepared
They looked at one another frankly_ and laughed * much reservation.,without,chagrin,eagerly,puzzled
Of course_ you split with us_ got mad_ took your dolls and all * sort of thing—we're all used to that—and we all sat tight because it looked good.,that,arising,speedy,method
That men fly in the air_ that men talk across seas by machines—as right presently they * talk mind to mind_ free of all mechanical hindrance—attracts no attention beyond passing chronicle in the argot of the day.,will,huge,And,soften
As he * never stopped to think_ after his arrival in St. Louis to seek his fortune_ whether or not his parents still were living_ we ourselves need ask no more than he.,himself,Van,spite,persuading
There's a little man on —— street.,Theres,He—Rawn—would,stolen,speaker
Helping colleges * old_ and so are libraries old.,is,continent,wrote—in,chauffeur
Both horses showed * of the keenness of the contest.,marks,Astleys,government,Grecian
She spoke of th*gs not in his knowledge though in hers.,in,vault,deliberately,effrontery
Heads_ in plenty_ of men and other *_ turned as they passed through in that careless throng of the world-wise and blasé.,women,dream—but,Company—a,men—my
Mr. Halsey found again his newspaper_ again wrapped up his machine *rein_ took it under his arm_ and hesitatingly turned toward the door_ the palest now_ and most unhappy of them all.,the,counting,consulted,walked
No sooner had the walk_ or rather canter over taken place_ than the lady_ \"dressed in a purple cap * waistcoat_ nankeen-coloured skirts_ purple shoes_ and embroidered stockings_\" appeared to ride against Buckle_ the famous jockey_ a match of two miles.,and,confirmation,Phenomenon,ways
I've never said a word to * yet_ of course_ and I don't want you to say a word.,him,Progressives,forgetting,goods—these
I won't work with men who haven't got heart in this thing.,wont,gray,Senate,Swiftly
U.S. laws alone swamp our * staff.,small,11th,theme,morale
He did not catch the * sob in her voice.,little,days—a,Hall—as,holdings
I'll be rich if this thing * through—one of the richest men in America.,goes,recognize,laughing,differences
Another phase of racing economy may be here alluded to_ and that * the propriety of peremptorily limiting the sport_ so that it may not occupy more than four days of the week.,is,21st,eightyfive,absorb
We are chiefly concerned that he shall be tall * shapely_ mighty in war and love_ and continuously engaged therein from the first moment of his entrance on our scene.,and,outburst,bread,some
She's got no wire or cord runnin' to her_ * belike it comes up through the flure.,unless,womanly,sick,striving
Once he came home with two lemons_ which had been given him_ perhaps as a peace-offering_ by a generous storekeeper.,peaceoffering,tis,Other,that—and
At Doncaster_ the various meetings are in the hands of the corporation_ the profits derived * to benefit the town.,going,blowing,stocked,vessels
It may be necessary for us to travel_ to see * of this country and Europe.,something,throbbed,wiped,impatience
Attempts have often been made * trace the beginnings of horse-racing_ but not with much success.,to,racecourse,Ribbon,enormous
Then Laura Rawn_ as was her wont_ passed silently up-stairs to her own apartments—or her bedroom_ as she called it—widely removed_ in the architect's plans_ from those of her husband.,upstairs,Where,arrangement,trained
It was a privilege for the other clerks who labored near him to * such calm_ such dignity.,see,Often,sadfaced,uncommunicative
*_ Sarah Chiffman_ 94_ Great Pulteney Street_ Golden Square.,Address,large,noted,prescribed
Newmarket_ * well as being head-quarters of the turf_ so far as sport is concerned_ is also a resort of many trainers: several stables of importance being located at that place.,as,joined,familiar,well
He paused in * literal reading from the printed page.,his,I—I—I,gambling,whole
Champion_ which also won the Derby_ was victor in the St. Leger of 1800_ * by Buckle.,ridden,capital,fortunate,Grosvenors
Of course_ you haven't made that much.,havent,disconnecting,poured,socalled
But John Rawn hesitated at * door.,this,pedestal,preferences,exalted
It's cheap_ after * this price.,all—at,Court,drag,each
About eight days before the race * was quoted at 100 to 12_ and seemed as if it would be a dangerous horse.,it,Ingenious,heads,1755
Here and there a face grew * flushed_ a tongue more fluent.,more,awtomo,overhead,bold
In each case his new-formed rule seemed to hold good; the exception being noted only in the bored and weary faces * men accompanied by women perhaps rustling and blazing in silks and diamonds_ but not owning youth and fascination.,of,grace,distance,countenance
Much scorn has been evinced at the poor part which was played * some \"horses of the East\" on Newmarket Heath_ when they ran in one or two races_ alongside_ or rather behind some of our national bred horses.,by,medicines,Chester,Minister
There can be no doubt that Admiral Rous thought he knew \"something\" more than * allowed to appear on the surface.,was,Johnson,mark,6th
* frown of consecrated unselfishness sat upon the brow of John Rawn.,A,grown,ways,steering
They turned to the department of mechanical installation; * brought Charles Halsey under investigation.,which,comported,mass,human
At morning_ at noon_ or at * eve_ in any assemblage or any chance situation_ they both played in the rôle assigned to them in their own ambitions.,dewy,college,ruddyfaced,domestic
There are a few things * you can do with most Project Gutenberg-tm electronic works even without complying with the full terms of this agreement.,that,proposals,hold,Gulnare
Rawn stood * watched them all.,and,international,ideas,house
But he had followed; and she was pleased at *_ almost to the point of ascribing to herself some charm which she herself had not suspected.,that,dream—but,Everythings,tallish
Its campaign_ whatever it was_ went * behind closed doors and closed mouths.,on,missing,girls,progressing
* was the older man's master.,He,changing,clerk,smiled
In * headquarter offices a vast_ smooth running business machine had now been built up.,the,Familiarities,effect,low
In his belief it was better to allow this * of silent partner to furnish the industry and the economy.,sort,six,iss,said
Halsey had little hope of ultimate * in his appliances.,success,deliberate,France,fullbearded
It was therefore arranged that the sportsmen_ as they returned from Epsom_ should be shown the corpse; and_ by various * stratagems_ be made to believe the man was alive.,little,Countless,animals,Nomenclature
I need di'mond earrings * bracelets to wear whin I'm makin' your beds_ you mind; and a silk dress that hollers 'I'm a-comin'!' whin I start out to scrub the steps.,and,further,impatience,quality
His wife_ Virginia_ came and took him by the * and had him within the door; closed it back of him; and_ leaving him_ advanced to where Halsey stood.,arm,myself—until,morose,blackened
It * the whole love of man for woman—I never knew before what that meant!  It wasn't for money_ but for you.,was,charm,spontaneous,value
Mr. Halsey will tell you what he has been doing in the works_ how he has been handicapped_ why we can not turn over at once a completed * of one of our motors.,installation,colored,longs,statement
Your place is over there * the works.,at,Theodosius,vibrations,gloom
A horse-race it is recorded was run on the River Ouse when it was * over in 1607_ and also in the following year.,frozen,waters,Englands,efficient
He often told his wife * daughter as much.,and,luxurious,throne,assigned
Her son slept_ * lower lip protruding_ his features grave_ his legs somewhat sprawled apart_ his mid-body somewhat distended_ his head sunken forward_ his hands drooping at his side.,his,convictions,showed,factories
Those persons who bet on the results of the race for the Cambridgeshire_ when they are so fortunate as to name the winner_ * obtain wonderfully good odds.,occasionally,demoralised,horseback,H
He gave a * of superb groan: \"All my life I have been trying for this_ and for what have I sacrificed it?\" he murmured.,sort,bank,taken,Mussulman
By way of contrast to this prudent Yorkshireman_ take the case of a young fellow who a good many * ago flashed upon the turf like a meteor.,years,Project,alternative,unsolicited
They parted after a time_ she scarce remembered how_ he to a couch which knew * sleep_ she to one that long remained untouched.,no,oval,letteropener,twelve
He gets kicked off twice * week_ but is a nice boy.,a,alluded,features,spins
The * is your own.,answer,green,closed,crazed
